259633421,Ban collar black jacket,A full black light-weight zipper jacket with ban collars and designed with simple and stylish look.,garments,men,2399,1500,pr001.jpg,20,20,20,20
419867220,Black shirt with zipper,"A black long-sleeved, long shirt with zippers and opening on the sideways",garments,men,999,750,pr002.jpg,20,20,20,20
59219083,Blue-t-shirt,"An elegant crew neck, half-sleeved blue shirt made up of soft and high quality cotton. ",garments,men,799,600,pr003.jpg,20,20,20,20
10741074,Casual woolen shirt,A soft woolen shirt made up of high quality fabric with two pockets in front and beautiful and contrasting black buttons,garments,men,1499,1100,pr004.jpg,20,20,20,20
812547283,Men check shirt,Wonderful high quality fabric check shirt for men with a choice of elegant styles.,garments,men,1299,900,pr005.jpg,20,20,20,20
504481663,Light blue denim jeans,High quality denim jeans made from imported fabric and with a cool look that will match with almost any color.,garments,men,1499,1000,pr006.jpg,20,20,20,20
69221146,Diesel denim jeans,High quality diesel colored jeans with a stylish look and elegant fabric with strechable texture.,garments,men,1499,1000,pr007.jpg,20,20,20,20
305491023,Onitsuka graphic t-shirt,Cool black t-shirt with a wonderful logo printed in red and white and made up of high quality fabric.,garments,men,799,600,pr008.jpg,20,20,20,20
101803247,Gray casual shirt,Simple and decent casual shirt for men who want to look simple as well as graceful. Made from high quality cotton ,garments,men,1299,900,pr009.jpg,20,20,20,20
722343992,Stylish gray casual shirt,Full sleeved and graceful looking casual shirt with grey color plus white texture on the soft and high quality fabric that looks appeasing for stylish outfits.,garments,men,1299,900,pr010.jpg,20,20,20,20
842274536,Grey-t-shirt,"An elegant crew neck, half-sleeved grey shirt made up of soft and high quality cotton.",garments,men,899,600,pr011.jpg,20,20,20,20
163876344,Lightweight mens jacket,Lightweight and stylish mens jacket made up of waterproof fabric style plus water resistance in one place.,garments,men,1999,1500,pr012.jpg,20,20,20,20
63014210,Karsten blue shirt,Royal blue half sleeved karsten collared shirt made up of fine combed cotton and having a front pocket on left.,garments,men,1199,900,pr013.png,20,20,20,20
937118745,Men black trousers,Lightweight men black trousers made with high quality fabric to provide for a comforting and simple outerlook.,garments,men,1299,950,pr014.jpg,20,20,20,20
920929836,Mens spring summer jacket,Lightweight men navy blue jacket made for style and grace in spring and summer seasons also providing resistance to water.,garments,men,1399,900,pr015.jpg,20,20,20,20
640830956,Puma trousers gray,Lightweight men black grey trousers made with high quality fabric to provide for a comforting and simple outerlook and manufactured by Puma,garments,men,1299,950,pr016.jpg,20,20,20,20
927657994,Purple-t-shirt,"An elegant crew neck, half-sleeved purple shirt made up of soft and high quality cotton.",garments,men,799,600,pr017.jpg,20,20,20,20
932537946,Skin jeans dark gray,High quality dark gray skin jeans made from imported fabric and with a cool look that will match with almost any color.,garments,men,1499,1100,pr018.jpg,20,20,20,20
148299047,Slate casual shirt,A soft casual shirt made up of high quality fabric with two pockets in front and beautiful and a warm slate color.,garments,men,1299,1000,pr019.jpg,20,20,20,20
936554377,Teal-t-shirt,"An elegant crew neck, half-sleeved teal colored shirt made up of soft and high quality cotton.",garments,men,799,600,pr020.jpg,20,20,20,20
890731107,Urban blue jeans,High quality urban jeans made from imported fabric and with a cool look that will match with almost any color.,garments,men,1599,1000,pr021.jpg,20,20,20,20
235795426,Anchor bracelet for men,This bracelet is made to provide men with additional bit of style in their outlook. Its made up of high quality synthetic leather and stainless steel anchor.,accessories,men,899,600,pr022.jpg,20,20,20,20
385926016,Black buddha bracelet,This bracelet is made to provide men with additional bit of style in their outlook. Its made up of high quality beads with a golden buddha head,accessories,men,899,600,pr023.jpg,20,20,20,20
596228986,Chakra bracelet,This bracelet is made to provide men with additional bit of style in their outlook. Its made up of high quality black as well as colored beads to provide for a colorful look.,accessories,men,899,600,pr024.jpg,20,20,20,20
942832363,Hot dog pin,High quality little pin made to stick to your shirt or jacket to provide additional style that stylish men wants.,accessories,men,699,450,pr025.jpg,20,20,20,20
495792569,Pizza enamel pin,High quality little pin made to stick to your shirt or jacket to provide additional style that stylish men wants.,accessories,men,699,450,pr026.jpg,20,20,20,20
183991488,Aqua Desi Kurti for women,Aqua colored kurti made for women who want to look cool plus desi in their outfit. Its made up of high quality fabric with stylish design on neck and sleeves.,garments,women,1999,1300,pr027.jpg,20,20,20,20
468021323,Embroidered white women top,Wonderful white colored shirt with flower embroidery on both sleeves. Its made up of high quality and soft fabric.,garments,women,1499,900,pr028.jpg,20,20,20,20
525110991,Orange Stylish Kurti for women,Orange colored dress made for women who want to look cool in their outfit. Its made up of high quality fabric with fresh bright orange color.,garments,women,1999,1500,pr029.jpg,20,20,20,20
824136583,Lightblue women top,Wonderful light blue women shirt with simple texture providing a decent look.,garments,women,1299,900,pr030.jpg,20,20,20,20
417545659,Pink Kurti,Pink colored  kurtimade for women who want to look cool plus desi in their outfit. Its made up of high quality silky fabric with a fabulous design. ,garments,women,1999,1500,pr031.jpg,20,20,20,20
257629160,Red t-shirt with pocket,Simple crewneck red color tee shirt for women who want to look cool in summers Its made up of high quality soft cotton fabric.,garments,women,999,650,pr032.jpg,20,20,20,20
552608539,Stylish red top,Stylish women top with stylish design on the sleeves and edges of the shirt.,garments,women,1299,950,pr033.jpg,20,20,20,20
364425657,Rama green rayon stylish top,Cool and wonderful rama green colored women top made up of high quality rayon fabric.,garments,women,1299,900,pr034.jpg,20,20,20,20
291594208,Straight fit orange kurti,Perfectly designed orange kurti with straight fit made for women with simple choice of style and elegance.,garments,women,1999,1300,pr035.jpg,20,20,20,20
859968701,Striped fashon t-shirt,Crewneck black and white striped tee shirt for women who want to look cool in summers Its made up of high quality soft cotton fabric.,garments,women,999,650,pr036.jpg,20,20,20,20
227770665,Trendy flowered pattern top,Cute looking women top with trendy flower patterns on all over the high quality fabric making it look so damn fabulous.,garments,women,1299,900,pr037.jpg,20,20,20,20
57029618,Women black top,Perfectly designed black with minimal design on fabric and made for women with simple choice of style and elegance.,garments,women,1299,1000,pr038.jpg,20,20,20,20
821702185,Womens boho top,Stylish women top with stylish design on the sleeves and edges of the shirt. Made with high quality fabric having beautiful blue pattern all over,garments,women,1799,1100,pr039.jpg,20,20,20,20
268341562,Black over the shoulder bag,Black colored over the shoulder bag made up of high quality synthetic leather and steel zippers that do not dissappoint.,accessories,women,3999,2700,pr040.jpg,20,20,20,20
423043113,Brown purse,Women purse with chocolate brown color made up of high quality material and quality buttons and zippers.,accessories,women,2999,2000,pr041.jpg,20,20,20,20
473867620,Light brown purse,Women purse with chocolate brown color made up of premium quality material and quality buttons and zippers.,accessories,women,2999,2200,pr042.jpg,20,20,20,20
547106337,Lemon purse,Cute lemon shaped purse for women who are looking to have cuteness and cool looking accessories,accessories,women,2599,1800,pr043.jpg,20,20,20,20
32185297,Light pink purse,Women purse with sweet pink color made up of premium quality material and quality buttons and zippers.,accessories,women,2999,2000,pr044.jpg,20,20,20,20
751295265,Marble fashion wristwatch,Wonderful black wrist watch for women. Its has premium quality soft leather straps and watch made up of water resistant material making it an excellent to have accessory.,accessories,women,1999,1400,pr045.jpg,20,20,20,20
286841512,Gold and blue necklace,Wonderfully designed and made necklace for women who love light and minimal jewellery with their outfits.,accessories,women,899,550,pr046.jpg,20,20,20,20
59403065,Women bracelet,Cool looking women bracelet made up of premium quality material and perfect for adding up more style to your outfits.,accessories,women,699,450,pr047.jpg,20,20,20,20
6573963,Threader necklace,Simple and decent looking necklace for women made up of high quality non corroding material.,accessories,women,999,699,pr048.jpg,20,20,20,20
408356328,Kid grey sweat pants,Lightweight sweat pant for kids made up of high quality soft and light woolen fabric.,garments,boys,999,650,pr049.jpg,20,20,20,20
506966333,Kid black beanie,Stylish beanie cap for kids made up of soft and warm fabric.,garments,boys,899,600,pr050.jpg,20,20,20,20
827129630,Kid raccoon tee,Stylish full sleeved black crewneck t-shirt with a raccoon print over the front made up of high quality soft fabric.,garments,boys,999,699,pr051.jpg,20,20,20,20
444036062,Black leather jacket for kids,Stylish kid leather jacket made up of premium quality synthetic leather.,garments,boys,999,699,pr052.jpg,20,20,20,20
94453653,Kid whale shirt,Stylish full sleeved black crewneck t-shirt with a raccoon print over the front made up of high quality soft fabric.,garments,boys,999,699,pr053.jpg,20,20,20,20
756741429,Kid zip-up,Cool looking zip up jacket for kids made up of two colored fabric blue and light grey.,garments,boys,1999,1400,pr054.jpg,20,20,20,20
272958703,Plaid shirt for kids,Soft woolen plaid casual shirt for kids. Its made up of fine cotton fabric and wonderful black and red color.,garments,boys,1299,900,pr055.jpg,20,20,20,20
700926637,girlss striped dress bl&w,Beautiful white and blue striped frock for little girlss. Its made up of soft and quality fabric that doesn't dissappoint.,garments,girls,1499,1000,pr056.jpg,20,20,20,20
276403844,girlss striped dress b&w,Beautiful white and black striped frock for little girlss. Its made up of soft and quality fabric that doesn't dissappoint.,garments,girls,1499,1000,pr057.jpg,20,20,20,20
790218731,Brown casuals,Casual brown shoes for men finely made with high quality leather adding a blast of style with jeans or shalwar kameez.,footwear,men,2999,2399,pr058.jpg,20,20,20,20
912432920,Marc jacob lace-up shoes ,Stylish looking high quality lace up shoes for men by Marc Jacob. Its you are the person looking for elegance in their footwear then this product is for you.,footwear,men,5999,4599,pr059.jpg,20,20,20,20
562467042,Men casual high sneakers,Cool casual sneakers with high tops for men wanting to add a touch of coolness to their styles,footwear,men,3999,2799,pr060.jpg,20,20,20,20
503054603,Navy blue skate shoes,Cool casual skate shoes with amazing contrasting color for men wanting to add a touch of coolness to their styles,footwear,men,2599,1999,pr061.jpg,20,20,20,20
71490686,Red LED shoes,Stylish Red colored sneakers with blue LED over the side of soles to make kids look stylish.,footwear,kids,2999,2499,pr062.jpg,20,20,20,20
514593898,All black sneakers,Completely black comfortable sneakers for men made up of premium quality material and strong stitching.,footwear,men,2999,2499,pr063.jpg,20,20,20,20
515762252,Shops23 sneakers,Stylish black and yellow sneakers for men who are looking to add touch of coolness to their footwear style.,footwear,men,3499,2999,pr064.jpg,20,20,20,20
32062942,White lowtop LED shoes,Stylish full white colored sneakers with blue LEDs over the side of soles to make kids look stylish.,footwear,kids,2999,2499,pr065.jpg,20,20,20,20
18540168,Kids Car t-shirt,Stylish full sleeved black crewneck t-shirt with a car print over the front made up of high quality soft fabric.,garments,boys,999,699,pr066.jpg,20,20,20,20
222769095,Kids Wear Kurta Shalwar,"Fabric: Cotton
Style: Shalwar Kameez
Mustard Color Self Printed & Embroidered Cotton Kids/boyss Salwar Kameez.
Printed Sleeves.
Self Printed Back
Plain White Trouser",Shalwar Kameez,boys,1800,1200,pr067.jpg,20,20,20,20
21907180,Kids Wear Kurta Shalwar,"Fabric: Cotton
Style: Salwar Kameez
Blue Color pati work over Cotton Kids/boyss Salwar Kameez.
Plain Sleeves.
Plain Back
Plain White Trouser",Shalwar Kameez,boys,1800,1200,pr068.jpg,20,20,20,20
733899282,Kids Wear Kurta Shalwar,"Blue Color Self Printed Cotton Kids/boyss Salwar Kameez.
Printed Sleeves.
Self Printed Back
Plain White Trouser",Shalwar Kameez,boys,1800,1200,pr069.jpg,20,20,20,20
223044410,Kids Wear Kurta Shalwar,"White Color Self Printed & Embroidered Cotton Kids/boyss Salwar Kameez.
Printed Sleeves.
Self Printed Back
Plain White Trouser",Shalwar Kameez,boys,1800,1200,pr070.jpg,20,20,20,20
543748232,Kids Wear Kurta Shalwar,"Fabric: Cotton
Style: Salwar Kameez
White Color Cotton Kids/boyss Salwar Kameez.
Plain Sleeves.
Plain Back
Plain White Trouser",Shalwar Kameez,boys,1800,1200,pr071.jpg,20,20,20,20
755269183,Kids Wear Kurta Shalwar,"Mustard Color Self Printed & Embroidered Cotton Kids/boyss Salwar Kameez. It has Printed Sleeves and
Self Printed Back it comes with a Plain White Trouser.",Shalwar Kameez,boys,1800,1200,pr072.jpg,20,20,20,20
442671523,Kids Wear Kurta Shalwar,"Fabric: Cotton
Style: Shalwar Kameez
Black Color Self Printed Cotton Kids/boyss Salwar Kameez.
Printed Sleeves.
Self Printed Back
Plain White Trouser",Shalwar Kameez,boys,1800,1200,pr073.jpg,20,20,20,20
150670852,Kids Wear Kurta Shalwar,"Fabric: Cotton
Style: Salwar Kameez
Purple Color Self Printed Cotton Kids/boyss Salwar Kameez.
Printed Sleeves.
Self Printed Back
Plain White Trouser",Shalwar Kameez,boys,1800,1200,pr074.jpg,20,20,20,20
184493919,Shoes by Armani Jeans,Casual shoes by Armani Jeans made with 100% quality material and strong stitching.,footwear,men,2799,2399,pr075.jpg,20,20,20,20
153543714,Blue denim jeans,High quality denim jeans made from imported fabric and with a cool look that will match with almost any color.,garments,men,1799,1200,pr076.jpg,20,20,20,20
691350157,Sweat shirt & Tee Combo by Z Zegna,High quality cotton shirts combo. One Long Sleeved Sweat shirt and one T-shirt with a printed logo. Deal of 2 in lowest price. ,garments,men,1799,1399,pr077.jpg,20,20,20,20
861717842,Sweat suit by Armani,A sweat shirt with a trouser made up of soft warm cotton for comfort lifestyle.,garments,men,2399,1799,pr078.jpg,20,20,20,20
112043827,Coat and Jeans Combo,A warm casual coat by Z Zegna paired up with a white jeans made up of high quality fabric and high quality stitching.,garments,men,3899,3399,pr079.jpg,20,20,20,20
571657306,SweatShirt Combo by Armani,A pair of two sweat shirts made up of high quality soft cotton with fleeced interior for perfect comfort.,garments,men,2600,2000,pr080.jpg,20,20,20,20
205608966,Jumper Jacket by Z Zegna,Light weight quilted jumper/gillet made up of water proof material and also equipped with a hood.,garments,men,1500,1100,pr081.jpg,20,20,20,20
860518618,Casual shirt combo,A pair of stylish casual shirts having different colors and cool patterns.,garments,men,1999,1599,pr082.jpg,20,20,20,20
42704218,Sweat and Dress shirt combo,Combo of sweat shirt styled with camoflage pattern and a light blue dress shirt with french collars.,garments,men,1999,1699,pr083.jpg,20,20,20,20
496986934,Kurta-1,Pakistani Stitch Pink Color Summer Lawn Kurta. Neck Embroidered With Tussles over Daman,Kurta,women,1199,800,pr084.jpg,10,10,10,10
321459467,Kurta-2,Pakistani Stitch Maroon Color Summer Lawn Kurta. Front Full Embroidered With Tussles over Daman,Kurta,women,1199,800,pr085.jpg,10,10,10,10
181111499,Kurta-3,Pakistani Stitch White Color Summer Lawn Kurta. Neck Embroidered With Stones at Daman,Kurta,women,1199,800,pr086.jpg,10,10,10,10
462523653,Kurta-4,Pakistani Stitch Green Color Summer Lawn Kurta. Neck Embroidered With Stone over Daman,Kurta,women,1199,800,pr087.jpg,10,10,10,10
989897551,Kurta-5,Pakistani Stitch Maroon Color Summer Lawn Kurta. Neck Embroidered & Printed Daman,Kurta,women,1199,800,pr088.jpg,10,10,10,10
57865456,Kurta-6,Pakistani Stitch Red Color Summer Lawn Kurta. Neck Embroidered & Printed Daman,Kurta,women,1199,800,pr089.jpg,10,10,10,10
82737614,Kurta-7,Pakistani Stitch Orange Color Summer Lawn Kurta. Neck Embroidered & Printed Daman,Kurta,women,1199,800,pr090.jpg,10,10,10,10
252169836,Kurta-8,Pakistani Stitch Black Color Summer Lawn Kurta. Neck Embroidered & Printed Daman,Kurta,women,1199,800,pr091.jpg,10,10,10,10
600602840,Kurta-9,Pakistani Stitch Green Color Summer Lawn Kurta. Neck Embroidered & Printed Daman,Kurta,women,1199,800,pr092.jpg,10,10,10,10
388018341,Kurta-10,Pakistani Stitch Yellow/White Color Summer Lawn Kurta. Neck Embroidered & Printed Daman,Kurta,women,1199,800,pr093.jpg,10,10,10,10
45900987,Kurta-11,Pakistani Stitch Pink Color Summer Lawn Kurta. Neck Embroidered & Printed Daman,Kurta,women,1199,800,pr094.jpg,10,10,10,10
282255646,Kurta-12,Pakistani Stitch Light Pink Color Summer Lawn Kurta. Neck Embroidered & Printed Daman,Kurta,women,1199,800,pr095.jpg,10,10,10,10
276823611,Kurta-13,Pakistani Stitch Yellow Color Summer Lawn Kurta. Neck Embroidered & Printed Daman,Kurta,women,1199,800,pr096.jpg,10,10,10,10
251788868,Kurta-14,Pakistani Stitch Grey-Blue Color Summer Lawn Kurta. Neck Embroidered & Printed Daman,Kurta,women,1199,800,pr097.jpg,10,10,10,10
682217538,Kurta-15,Pakistani Stitch Multi Color Summer Lawn Kurta. Neck Embroidered & Printed Daman,Kurta,women,1199,800,pr098.jpg,10,10,10,10
527243340,Kurta-16,Pakistani Stitch Yellow Color Summer Lawn Kurta. Neck Embroidered & Printed Daman,Kurta,women,1199,800,pr099.jpg,10,10,10,10
952243705,Kurta-17,Pakistani Stitch Multi Color Summer Lawn Kurta. Neck Embroidered & Printed Daman,Kurta,women,1199,800,pr100.jpg,10,10,10,10
486302861,Kurta-18,Pakistani Stitch light green Color Summer Lawn Kurta. Neck Embroidered & Printed Daman,Kurta,women,1199,800,pr101.jpg,10,10,10,10
872414156,Kurta-19,Pakistani Stitch Skin Color Summer Lawn Kurta. Neck Embroidered & Printed Daman,Kurta,women,1199,800,pr102.jpg,10,10,10,10
599033464,Kurta-20,Pakistani Stitch Pink Color Summer Lawn Kurta. Neck Embroidered & Printed Daman,Kurta,women,1199,800,pr103.jpg,10,10,10,10
936899417,Kurta-21,Pakistani Stitch Dark Pink Color Summer Lawn Kurta. Full Embroidered & Printed Daman,Kurta,women,1199,800,pr104.jpg,10,10,10,10
19653815,Stitched Embroidered Lawn Trouser,"Amazing Plain Black Color Stitched Embroidered Lawn Trouser
Black Color Velvet Lace Work with Velvet Buttons Over Lawn Trouser Embroidered
Packing: Plastic bag ",Trouser,women,1299,900,pr105.jpg,10,10,10,10
741799825,Stitched Embroidered Lawn Trouser,"Amazing Plain Skin Color Stitched Embroidered Lawn Trouser
Skin Color Chiffon Lace Work with Velvet Buttons Over Lawn Trouser Embroidered
Packing: Plastic bag ",Trouser,women,1299,900,pr106.jpg,10,10,10,10
982789332,Stitched Embroidered Lawn Trouser,"Amazing Plain White Color Stitched Embroidered Lawn Trouser
White Color Embroidered Lace Work Over Lawn Trouser Embroidered
Packing: Plastic bag ",Trouser,women,1299,900,pr107.jpg,10,10,10,10
973168261,Stitched Embroidered Lawn Trouser,"Amazing Black Color Stitched Embroidered Lawn Trouser
Sliver Color Embroidery Work Over Lawn Trouser Embroidered
Packing: Plastic bag ",Trouser,women,999,700,pr108.jpg,10,10,10,10
264467647,Stitched Embroidered Lawn Trouser,"Amazing Black Color Stitched Embroidered Lawn Trouser
Black Color Embroidery Work Over Lawn Trouser Embroidered
Packing: Plastic bag ",Trouser,women,999,700,pr109.jpg,10,10,10,10
455970593,Stitched Embroidered Lawn Trouser,"Amazing White Color Stitched Embroidered Lawn Trouser
Red Color Flower Embroidery Work Over Lawn Trouser Embroidered
Packing: Plastic bag",Trouser,women,999,700,pr110.jpg,10,10,10,10
605579392,Stitched Embroidered Lawn Trouser,"Amazing Skin Color Stitched Embroidered Lawn Trouser
Skin Color Embroidery Work Over Lawn Trouser Embroidered
Packing: Plastic bag",Trouser,women,999,700,pr111.jpg,10,10,10,10
376593489,Stitched Embroidered Lawn Trouser,"Amazing Skin Color Stitched Embroidered Lawn Trouser
Silver Color Embroidery Work Over Lawn Trouser Embroidered
Packing: Plastic bag",Trouser,women,999,700,pr112.jpg,10,10,10,10
692015318,Stitched Embroidered Lawn Trouser,"Amazing White Color Stitched Embroidered Lawn Trouser
White Color Embroidery Work Over Lawn Trouser Embroidered
Packing: Plastic bag",Trouser,women,999,700,pr113.jpg,10,10,10,10
190781218,Stitched Embroidered Lawn Trouser,"Amazing White Color Stitched Embroidered Lawn Trouser
Skin Color Embroidery Work Over Lawn Trouser Embroidered
Packing: Plastic bag",Trouser,women,999,700,pr114.jpg,10,10,10,10
560167845,High tops by Armani Jeans,Casual high topped shoes by Armani Jeans made with 100% quality material and strong stitching.,footwear,men,3199,2599,pr115.jpg,20,20,20,20
